{
  "profile": "gsc-assetsymbol-bridge/1.0-candidate.1",
  "source_profile": {
    "schema": "evemisslab.symbolic-image",
    "version": "0.7",
    "mode": "strict-source-blind",
    "encoding": "palette-runs"
  },
  "source_artifact": {
    "path": "gsc_generated_assetsymbol_v07.json",
    "sha256": "8a8dd40d1aa01f2f42f1503c30b2205fa191966b958473147910280132835659"
  },
  "bridge_fidelity": "carry-lossless",
  "mapped": {
    "design_space": {
      "canvas": {
        "width": 4,
        "height": 4,
        "pixelAspect": 1
      }
    },
    "exact_carry": {
      "kind": "palette-runs-v1",
      "palette": [
        [
          0,
          0,
          0,
          0
        ],
        [
          255,
          255,
          255,
          255
        ],
        [
          255,
          0,
          0,
          255
        ]
      ],
      "runs": [
        {
          "op": "RUN",
          "y": 0,
          "x": 0,
          "length": 1,
          "palette_index": 0
        },
        {
          "op": "RUN",
          "y": 0,
          "x": 1,
          "length": 2,
          "palette_index": 1
        },
        {
          "op": "RUN",
          "y": 0,
          "x": 3,
          "length": 1,
          "palette_index": 0
        },
        {
          "op": "RUN",
          "y": 1,
          "x": 0,
          "length": 1,
          "palette_index": 1
        },
        {
          "op": "RUN",
          "y": 1,
          "x": 1,
          "length": 2,
          "palette_index": 2
        },
        {
          "op": "RUN",
          "y": 1,
          "x": 3,
          "length": 1,
          "palette_index": 1
        },
        {
          "op": "RUN",
          "y": 2,
          "x": 0,
          "length": 1,
          "palette_index": 1
        },
        {
          "op": "RUN",
          "y": 2,
          "x": 1,
          "length": 2,
          "palette_index": 2
        },
        {
          "op": "RUN",
          "y": 2,
          "x": 3,
          "length": 1,
          "palette_index": 1
        },
        {
          "op": "RUN",
          "y": 3,
          "x": 0,
          "length": 1,
          "palette_index": 0
        },
        {
          "op": "RUN",
          "y": 3,
          "x": 1,
          "length": 2,
          "palette_index": 1
        },
        {
          "op": "RUN",
          "y": 3,
          "x": 3,
          "length": 1,
          "palette_index": 0
        }
      ]
    },
    "topology": {
      "regions": [
        {
          "id": "REGION_0000",
          "paletteIndex": 0,
          "area": 1,
          "bbox": {
            "x": 0,
            "y": 0,
            "width": 1,
            "height": 1
          },
          "centroid": {
            "x": 0,
            "y": 0
          },
          "topology": {
            "boundary": [
              [
                0,
                0
              ]
            ],
            "boundaryPixelCount": 1,
            "perimeter": 4,
            "holeCount": 0,
            "fillRatio": 1,
            "symmetry": {
              "vertical": 1,
              "horizontal": 1
            },
            "contour": {
              "orderedAnchors": [
                {
                  "x": 0,
                  "y": 0,
                  "type": "NW",
                  "source": "corner",
                  "angle": 0
                },
                {
                  "x": 1,
                  "y": 0,
                  "type": "NE",
                  "source": "corner",
                  "angle": 0
                },
                {
                  "x": 1,
                  "y": 1,
                  "type": "SE",
                  "source": "corner",
                  "angle": 0.785398
                },
                {
                  "x": 0,
                  "y": 1,
                  "type": "SW",
                  "source": "corner",
                  "angle": 1.570796
                }
              ],
              "turningPoints": [
                {
                  "x": 0,
                  "y": 0,
                  "type": "NW",
                  "angle": 0,
                  "source": "corner"
                },
                {
                  "x": 1,
                  "y": 0,
                  "type": "NE",
                  "angle": 0,
                  "source": "corner"
                },
                {
                  "x": 1,
                  "y": 1,
                  "type": "SE",
                  "angle": 0.785398,
                  "source": "corner"
                },
                {
                  "x": 0,
                  "y": 1,
                  "type": "SW",
                  "angle": 1.570796,
                  "source": "corner"
                }
              ],
              "anchorCount": 4,
              "turnCount": 4
            },
            "medial": {
              "algorithm": "zhang-suen+manhattan-distance-v0.1",
              "skeletonPixels": [],
              "endpointPixels": [],
              "junctionPixels": [],
              "skeletonPixelCount": 0,
              "endpointCount": 0,
              "junctionCount": 0,
              "maxRadius": 0,
              "meanRadius": 0,
              "thinningIterations": 0,
              "graph": {
                "algorithm": "skeleton-graph-v0.1",
                "nodes": [],
                "edges": [],
                "nodeCount": 0,
                "edgeCount": 0,
                "branchlessPathCount": 0,
                "skipped": true
              },
              "skipped": true
            },
            "isTransparent": true
          },
          "partGrammar": {
            "id": "PART_0000",
            "regionId": "REGION_0000",
            "paletteIndex": 0,
            "primitive": "carrier",
            "orientation": "background",
            "role": "background-carrier",
            "symmetryClass": "bilateral",
            "areaRank": null,
            "adjacencyDegree": 2,
            "attachments": [
              "REGION_0001",
              "REGION_0003"
            ],
            "bbox": {
              "x": 0,
              "y": 0,
              "width": 1,
              "height": 1
            },
            "area": 1,
            "holeCount": 0,
            "fillRatio": 1,
            "graphNodeCount": 0,
            "graphEdgeCount": 0
          }
        },
        {
          "id": "REGION_0001",
          "paletteIndex": 1,
          "area": 2,
          "bbox": {
            "x": 1,
            "y": 0,
            "width": 2,
            "height": 1
          },
          "centroid": {
            "x": 1.5,
            "y": 0
          },
          "topology": {
            "boundary": [
              [
                1,
                0
              ],
              [
                2,
                0
              ]
            ],
            "boundaryPixelCount": 2,
            "perimeter": 6,
            "holeCount": 0,
            "fillRatio": 1,
            "symmetry": {
              "vertical": 1,
              "horizontal": 1
            },
            "contour": {
              "orderedAnchors": [
                {
                  "x": 3,
                  "y": 0,
                  "type": "NE",
                  "source": "corner",
                  "angle": 0
                },
                {
                  "x": 3,
                  "y": 1,
                  "type": "SE",
                  "source": "corner",
                  "angle": 0.588003
                },
                {
                  "x": 1,
                  "y": 1,
                  "type": "SW",
                  "source": "corner",
                  "angle": 2.034444
                },
                {
                  "x": 1,
                  "y": 0,
                  "type": "NW",
                  "source": "corner",
                  "angle": 3.141593
                }
              ],
              "turningPoints": [
                {
                  "x": 3,
                  "y": 0,
                  "type": "NE",
                  "angle": 0,
                  "source": "corner"
                },
                {
                  "x": 3,
                  "y": 1,
                  "type": "SE",
                  "angle": 0.588003,
                  "source": "corner"
                },
                {
                  "x": 1,
                  "y": 1,
                  "type": "SW",
                  "angle": 2.034444,
                  "source": "corner"
                },
                {
                  "x": 1,
                  "y": 0,
                  "type": "NW",
                  "angle": 3.141593,
                  "source": "corner"
                }
              ],
              "anchorCount": 4,
              "turnCount": 4
            },
            "medial": {
              "algorithm": "zhang-suen+manhattan-distance-v0.1",
              "skeletonPixels": [
                {
                  "x": 1,
                  "y": 0,
                  "radius": 1,
                  "degree": 1
                },
                {
                  "x": 2,
                  "y": 0,
                  "radius": 1,
                  "degree": 1
                }
              ],
              "endpointPixels": [
                {
                  "x": 1,
                  "y": 0,
                  "radius": 1,
                  "degree": 1
                },
                {
                  "x": 2,
                  "y": 0,
                  "radius": 1,
                  "degree": 1
                }
              ],
              "junctionPixels": [],
              "skeletonPixelCount": 2,
              "endpointCount": 2,
              "junctionCount": 0,
              "maxRadius": 1,
              "meanRadius": 1,
              "thinningIterations": 1,
              "graph": {
                "algorithm": "skeleton-graph-v0.1",